Title,Link,Date
The ACLU Fights for Your Constitutional Right to Make Deepfakes,https://www.wired.com/story/aclu-artificial-intelligence-deepfakes-free-speech/,7/26/2024
"For the Director ofWicked, There’s No Place Like Silicon Valley",https://www.wired.com/story/jon-chu-director-wicked-crazy-rich-asians-silicon-valley/,7/26/2024
"Priscila, Queen of the Rideshare Mafia",https://www.wired.com/story/priscila-queen-of-the-rideshare-mafia/,7/26/2024
How to Get Rich From Peeping Inside People’s Fridges,https://www.wired.com/story/get-rich-peeping-inside-fridges/,7/26/2024
SimCityIsn’t a Model of Reality. It’s a Libertarian Toy Land,https://www.wired.com/story/simcity-libertarian-toy-land/,7/26/2024
The Best Folding Phones,https://www.wired.com/gallery/best-folding-phones/,7/26/2024
Give Your Back a Break With Our Favorite Office Chairs,https://www.wired.com/gallery/best-office-chairs/,7/26/2024
Take Cannondale's Brawny Electric Mountain Bike up Some Big-Ass Mountains,https://www.wired.com/review/cannondale-moterra-carbon-sl2/,7/26/2024
The New Beats Pill Is a Serious Contender in a Crowded Field,https://www.wired.com/review/beats-pill-2024/,7/26/2024
The Samsung Galaxy Watch Ultra Isn’t an Apple Watch Ultra Dupe … Yet,https://www.wired.com/review/samsung-galaxy-watch-ultra/,7/26/2024
A One-Time Poultry Farmer Invents the Future of Refrigeration,https://www.wired.com/story/refrigeration-global-warming-food-preservation/,7/26/2024
Check In With the Velociraptor at the World's First Robot Hotel,https://www.wired.com/2016/03/robot-henn-na-hotel-japan/,7/26/2024
The Greatest Climate-Protecting Technology Ever Devised,https://www.wired.com/story/trees-plants-nature-best-carbon-capture-technology-ever/,7/26/2024
Brandon Sanderson Is Your God,https://www.wired.com/story/brandon-sanderson-is-your-god/,7/26/2024
On the Trail of the Fentanyl King,https://www.wired.com/story/on-the-trail-of-the-fentanyl-king/,7/26/2024
Sonos Admits Its Recent App Update Was a Colossal Mistake,https://www.wired.com/story/sonos-admits-its-recent-app-update-was-a-colossal-mistake/#intcid=_wired-verso-hp-trending_95230c7c-7b93-4584-81ac-847346cf7be7_popular4-1_fallback_cral-top2-2,7/26/2024
California Supreme Court Rules That Uber and Lyft Drivers Will Remain Independent Contractors,https://www.wired.com/story/california-supreme-court-uber-lyft-drivers-independent-contractors/#intcid=_wired-verso-hp-trending_95230c7c-7b93-4584-81ac-847346cf7be7_popular4-1_fallback_cral-top2-2,7/26/2024
SearchGPT Is OpenAI’s Direct Assault on Google,https://www.wired.com/story/searchgpt-openai-search-engine-generative-ai/#intcid=_wired-verso-hp-trending_95230c7c-7b93-4584-81ac-847346cf7be7_popular4-1_fallback_cral-top2-2,7/26/2024
The 21 Best Movies on Apple TV+ Right Now,https://www.wired.com/story/best-apple-tv-plus-movies/#intcid=_wired-verso-hp-trending_95230c7c-7b93-4584-81ac-847346cf7be7_popular4-1_fallback_cral-top2-2,7/26/2024
Jeremy Renner Answers The Web's Most Searched Questions,https://www.wired.com/video/watch/google-autocomplete-inverviews-jeremy-renner-answers-the-webs-most-searched-questions,7/26/2024
Professor Answers Ancient Greece Questions From Twitter,https://www.wired.com/video/watch/tech-support-professor-answers-ancient-greece-questions-from-twitter,7/26/2024
'The Boys' Cast Answer The Web's Most Searched Questions,https://www.wired.com/video/watch/the-boys-cast-answer-the-webs-most-searched-questions,7/26/2024
Storm Chaser Answers Severe Weather Questions From Twitter,https://www.wired.com/video/watch/tech-support-stormchaser-answers-extreme-weather-questions-from-twitter,7/26/2024
"What Speakers That Cost $370,000 Sound Like",https://www.wired.com/video/watch/wired-desired-speakers,7/26/2024
Will Ferrell & Kristen Wiig Answer The Web's Most Searched Questions,https://www.wired.com/video/watch/google-autocomplete-inverviews-kristen-wiig-and-will-ferrell-answer-the-webs-most-searched-questions,7/26/2024
Iggy Azalea Answers The Web's Most Searched Questions,https://www.wired.com/video/watch/google-autocomplete-inverviews-iggy-azalea-answers-the-web-most-searched-questions,7/26/2024
Pyrotechnician Answers Fireworks Questions From Twitter,https://www.wired.com/video/watch/tech-support-pyrotechnician-answers-fireworks-questions-from-twitter,7/26/2024
Miranda Cosgrove Answers The Web's Most Searched Questions,https://www.wired.com/video/watch/google-autocomplete-inverviews-miranda-cosgrove-answers-the-webs-most-searched-questions,7/26/2024
Patton Oswalt Answers The Web's Most Searched Questions,https://www.wired.com/video/watch/google-autocomplete-inverviews-patton-oswalt-answers-his-most-searched-questions,7/26/2024
